A1: 2004 Lake Forest Park Stream Keepers Chemical Data
A3: Winter 2004
A4: Stream | B4: Reach | C4: # | D4: Box | E4: Date | F4: Turbidity | G4: T F | H4: TC | I4: TV | J4: pH | K4: HV | L4: DO mg/l | M4: DV
A5: Lyon | B5: 35th - North of Ballinger | C5: 2 | D5: B | E5: 38003 | F5: Clear | G5: 45 | H5: =(G5-32)/1.8 -> 7.2222222222222223 | I5: AA | J5: 7.5 | K5: AA | L5: 13 | M5: AA
A6: Bruggers | B6: Bruggers Bog | C6: 4.1 | D6: R | E6: 38003 | F6: Clear | G6: 46 | H6: =(G6-32)/1.8 -> 7.7777777777777777 | I6: AA | J6: 7.5 | K6: AA | L6: 10.5 | M6: AA
A7: Bruggers | B7: Ballinger Way | C7: 4.2 | D7: Y | E7: 38003 | F7: Clear | G7: 45 | H7: =(G7-32)/1.8 -> 7.2222222222222223 | I7: AA | J7: 7.5 | K7: AA | L7: 11.5 | M7: AA
A8: Lyon | B8: 35th (South of 185th) | D8: R | E8: 38003 | F8: Clear | G8: 46 | H8: =(G8-32)/1.8 -> 7.7777777777777777 | I8: AA | J8: 7.5 | K8: AA | L8: 5.5 *
A9: Lyon | B9: Town Center | C9: 3 | D9: R | E9: 38003 | F9: Clear | G9: 43 | H9: =(G9-32)/1.8 -> 6.1111111111111107 | I9: AA | J9: 7.5 | K9: AA | L9: 11 | M9: AA
A10: McAleer | B10: 196th (Under Road) | C10: 12 | D10: G | E10: 38003 | F10: Cloudy | G10: 40 | H10: =(G10-32)/1.8 -> 4.4444444444444446 | I10: AA | J10: 7.5 | K10: AA | L10: 6 *
A11: McAleer | B11: 182th by Big Retain. Wall | C11: 13 | D11: G | E11: 38003 | F11: NA | G11: 40 | H11: =(G11-32)/1.8 -> 4.4444444444444446 | I11: AA | J11: 7.5 | K11: AA | L11: 3.5 *
A12: Brookside | B12: 28th (Grace Cole Park) | C12: 15.2 | D12: Y | E12: 38003 | F12: Clear | G12: 44 | H12: =(G12-32)/1.8 -> 6.6666666666666661 | I12: AA | J12: 7.5 | K12: AA | L12: 11 | M12: AA
A13: Brookside | B13: 28th Ave Restoration Site | D13: B | E13: 38003 | F13: Clear | G13: 42 | H13: =(G13-32)/1.8 -> 5.5555555555555554 | I13: AA | J13: 7 | K13: AA | L13: 12 | M13: AA
A14: Hillside | B14: 35th Ave @ End | C14: 15.3 | D14: Y | E14: 38003 | F14: Clear | G14: 42 | H14: =(G14-32)/1.8 -> 5.5555555555555554 | I14: AA | J14: 8.5 | K14: AA | L14: 12 | M14: AA
A15: Sheridan | B15: 37th NE (S of School) | D15: B | E15: 38003 | F15: Clear | G15: 44 | H15: =(G15-32)/1.8 -> 6.6666666666666661 | I15: AA | J15: 7.5 | K15: AA | L15: 12 | M15: AA
A16: McAleer | B16: Blue Heron Park | C16: 14 | D16: G | E16: 38003 | F16: Cloudy | G16: 40 | H16: =(G16-32)/1.8 -> 4.4444444444444446 | I16: AA | J16: 7.5 | K16: AA | L16: 13 | M16: AA
A17: Key: in each case "AA" is the highest level of water quality
A18: TF is temperature Fahrenheit; TC is Temp. Centigrade; TV is the EPA's evaluation of that temperature -- colder the better.
A19: pH is the measure of acidity; HV is the EPA's evaluation of that level --- 6.5 to 8.5 is AA.
A20: DO is dissolved oxygen; DV is the EPA's evaluation of that level -- the higher the better, 10 is AA.
A21: * It is believed that the low readings were due to faulty test equipment rather than actual stream conditions
A23: Spring 2004
A24: Stream | B24: Reach | C24: # | D24: Box | E24: Date | F24: Turbidity | G24: T F | H24: TC | I24: TV | J24: pH | K24: HV | L24: DO mg/l | M24: DV
A25: Lyon | B25: 35th - North of Ballinger | C25: 2 | D25: B | E25: 38094 | F25: Clear | G25: 52 | H25: =(G25-32)/1.8 -> 11.111111111111111 | I25: AA | J25: 7.5 | K25: AA | L25: 12 | M25: AA
A26: Bruggers | B26: Bruggers Bog | C26: 4.1 | D26: R | E26: 38094 | F26: Clear | G26: 51 | H26: =(G26-32)/1.8 -> 10.555555555555555 | I26: AA | J26: 7.5 | K26: AA | L26: 11.5 | M26: AA
A27: Bruggers | B27: Ballinger Way | C27: 4.2 | D27: Y | E27: 38094 | F27: Clear | G27: 51 | H27: =(G27-32)/1.8 -> 10.555555555555555 | I27: AA | J27: 7.5 | K27: AA | L27: 12 | M27: AA
A28: Lyon | B28: 35th (South of 185th) | D28: R | E28: 38094 | F28: Pr. Cloudy | G28: 53 | H28: =(G28-32)/1.8 -> 11.666666666666666 | I28: AA | J28: 7.5 | K28: AA | L28: 11 | M28: AA
A29: Lyon | B29: Town Center | C29: 3 | D29: R | E29: 38094 | F29: Clear | G29: 53 | H29: =(G29-32)/1.8 -> 11.666666666666666 | I29: AA | J29: 7.5 | K29: AA | L29: 10.5 | M29: AA
A30: McAleer | B30: 196th (Under Road) | C30: 12 | D30: G | E30: 38094 | F30: Pr. Cloudy | G30: 53 | H30: =(G30-32)/1.8 -> 11.666666666666666 | I30: AA | J30: 8 | K30: AA | L30: 10.5 | M30: AA
A31: McAleer | B31: 182th by Big Retain. Wall | C31: 13 | D31: G | E31: 38094 | F31: Cloudy | G31: 52 | H31: =(G31-32)/1.8 -> 11.111111111111111 | I31: AA | J31: 7.75 | K31: AA | L31: 10.5 | M31: AA
A32: Brookside | B32: 28th (Grace Cole Park) | C32: 15.2 | D32: Y | E32: 38094 | F32: Clear | G32: 52 | H32: =(G32-32)/1.8 -> 11.111111111111111 | I32: AA | J32: 7.75 | K32: AA | L32: 11 | M32: AA
A33: Brookside | B33: 28th Ave Restoration Site | D33: B | E33: 38094 | F33: Clear | G33: 53 | H33: =(G33-32)/1.8 -> 11.666666666666666 | I33: AA | J33: 7.5 | K33: AA | L33: 11 | M33: AA
A34: Hillside | B34: 35th Ave @ End | C34: 15.3 | D34: Y | E34: 38094 | F34: Clear | G34: 50 | H34: =(G34-32)/1.8 -> 10 | I34: AA | J34: 8 | K34: AA | L34: 12 | M34: AA
A35: Sheridan | B35: 37th NE (S of School) | D35: B | E35: 38094 | F35: Clear | G35: 52 | H35: =(G35-32)/1.8 -> 11.111111111111111 | I35: AA | J35: 7.5 | K35: AA | L35: 12 | M35: AA
A36: McAleer | B36: Blue Heron Park | C36: 14 | D36: G | E36: 38094 | F36: Cloudy | G36: 51 | H36: =(G36-32)/1.8 -> 10.555555555555555 | I36: AA | J36: 8 | K36: AA | L36: 10.5 | M36: AA
A37: Key: in each case "AA" is the highest level of water quality
A38: TF is temperature Fahrenheit; TC is Temp. Centigrade; TV is the EPA's evaluation of that temperature -- colder the better.
A39: pH is the measure of acidity; HV is the EPA's evaluation of that level --- 6.5 to 8.5 is AA.
A40: DO is dissolved oxygen; DV is the EPA's evaluation of that level -- the higher the better, 10 is AA.
A43: Summer 2004
A44: Stream | B44: Reach | C44: # | D44: Box | E44: Date | F44: Turbidity | G44: T F | H44: TC | I44: TV | J44: pH | K44: HV | L44: DO mg/l | M44: DV
A45: Lyon | B45: 35th - North of Ballinger | C45: 2 | D45: B | E45: 38185 | F45: Clear | G45: 64 | H45: =(G45-32)/1.8 -> 17.777777777777779 | J45: 7.5 | K45: AA | L45: 11 | M45: AA
A46: Bruggers | B46: Bruggers Bog | C46: 4.1 | D46: R | E46: 38185 | G46: 61 | H46: =(G46-32)/1.8 -> 16.111111111111111 | J46: 7.5 | K46: AA | L46: 8.75
A47: Bruggers | B47: Ballinger Way | C47: 4.2 | D47: Y | E47: 38185 | F47: Clear | G47: 61 | H47: =(G47-32)/1.8 -> 16.111111111111111 | J47: 7.7 | K47: AA | L47: 11 | M47: AA
A48: Lyon | B48: 35th (South of 185th) | C48: 1 | D48: R | E48: 38185 | F48: Clear | G48: 61 | H48: =(G48-32)/1.8 -> 16.111111111111111 | J48: 7.5 | K48: AA | L48: 9.5
A49: Lyon | B49: Town Center | C49: 1 | D49: R | E49: 38185 | F49: Clear | G49: 65 | H49: =(G49-32)/1.8 -> 18.333333333333332 | J49: 7.5 | K49: AA | L49: 7
A50: McAleer | B50: 196th (Under Road) | C50: 5 | D50: G | E50: 38185 | F50: Clear | G50: 59 | H50: =(G50-32)/1.8 -> 15 | J50: 7.5 | K50: AA | L50: 12 | M50: AA
A51: McAleer | B51: 182th by Big Retain. Wall | C51: 4 | D51: G | E51: 38185 | F51: Clear | G51: 59 | H51: =(G51-32)/1.8 -> 15 | J51: 8 | K51: AA | L51: 12 | M51: AA
A52: Brookside | B52: 28th (Grace Cole Park) | C52: 2A | D52: Y | E52: 38185 | F52: Clear | G52: 58 | H52: =(G52-32)/1.8 -> 14.444444444444445 | J52: 7.5 | K52: AA | L52: 11 | M52: AA
A53: Brookside | B53: 28th Ave Restoration Site | C53: 2A | D53: B | E53: 38185 | F53: Clear | G53: 60 | H53: =(G53-32)/1.8 -> 15.555555555555555 | J53: 7.3 | K53: AA | L53: 11 | M53: AA
A54: Hillside | B54: 35th Ave @ End | C54: 2A | D54: Y | E54: 38185 | F54: Clear | G54: 60 | H54: =(G54-32)/1.8 -> 15.555555555555555 | J54: 7.5 | K54: AA | L54: 11 | M54: AA
A55: Sheridan | B55: 37th NE (S of School) | C55: 2A | D55: B | E55: 38185 | F55: Pr Cloudy | G55: 61 | H55: =(G55-32)/1.8 -> 16.111111111111111 | J55: 7.5 | K55: AA | L55: 10.5 | M55: AA
A56: McAleer | B56: Blue Heron Park | C56: 2 | D56: G | E56: 38185 | F56: Clear | G56: 59.5 | H56: =(G56-32)/1.8 -> 15.277777777777777 | J56: 7.5 | K56: AA | L56: 11.5 | M56: AA
A57: Key: in each case "AA" is the highest level of water quality
A58: TF is temperature Fahrenheit; TC is Temp. Centigrade; TV is the EPA's evaluation of that temperature -- colder the better.
A59: pH is the measure of acidity; HV is the EPA's evaluation of that level --- 6.5 to 8.5 is AA.
A60: DO is dissolved oxygen; DV is the EPA's evaluation of that level -- the higher the better, 10 is AA.
A63: Fall 2004
A64: Stream | B64: Reach | C64: # | D64: Box | E64: Date | F64: Turbidity | G64: T F | H64: TC | I64: TV | J64: pH | K64: HV | L64: DO mg/l | M64: DV
A65: Lyon | B65: 35th - North of Ballinger | C65: 2 | D65: B | E65: 38283 | F65: Clear | G65: 50 | H65: =(G65-32)/1.8 -> 10 | I65: AA | J65: 7.5 | K65: AA | L65: 12 | M65: AA
A66: Bruggers | B66: Bruggers Bog | C66: 4.1 | D66: R | E66: 38283 | F66: Clear | G66: 51 | H66: =(G66-32)/1.8 -> 10.555555555555555 | I66: AA | J66: 7.5 | K66: AA | L66: 9
A67: Bruggers | B67: Ballinger Way | C67: 4.2 | D67: Y | E67: 38283 | F67: Clear | G67: 49.5 | H67: =(G67-32)/1.8 -> 9.7222222222222214 | I67: AA | J67: 7.5 | K67: AA | L67: 12.5 | M67: AA
A68: Lyon | B68: 35th (South of 185th) | D68: R | E68: 38283 | F68: Clear | G68: 49 | H68: =(G68-32)/1.8 -> 9.4444444444444446 | I68: AA | J68: 7.5 | K68: AA | L68: 11 | M68: AA
A69: Lyon | B69: Town Center | C69: 3 | D69: R | E69: 38283 | F69: Clear | G69: 49 | H69: =(G69-32)/1.8 -> 9.4444444444444446 | I69: AA | J69: 7.5 | K69: AA | L69: 10.5 | M69: AA
A70: McAleer | B70: 196th (Under Road) | C70: 12 | D70: G | E70: 38283 | F70: NA | G70: 54 | H70: =(G70-32)/1.8 -> 12.222222222222221 | I70: AA | J70: 7.5 | K70: AA | L70: 7
A71: McAleer | B71: 182th by Big Retain. Wall | C71: 13 | D71: G | E71: 38283 | G71: 53 | H71: =(G71-32)/1.8 -> 11.666666666666666 | I71: AA | J71: 8 | K71: AA | L71: 9
A72: Brookside | B72: 28th (Grace Cole Park) | C72: 15.2 | D72: Y | E72: 38283 | F72: Clear | G72: 50 | H72: =(G72-32)/1.8 -> 10 | I72: AA | J72: 7.5 | K72: AA | L72: 10 | M72: AA
A73: Brookside | B73: 28th Ave Restoration Site | D73: B | E73: 38283 | F73: NA | G73: NA | J73: NA | L73: NA
A74: Hillside | B74: 35th Ave @ End | C74: 15.3 | D74: Y | E74: 38283 | F74: Cloudy | G74: 49 | H74: =(G74-32)/1.8 -> 9.4444444444444446 | I74: AA | J74: 8 | K74: AA | L74: 12 | M74: AA
A75: Sheridan | B75: 37th NE (S of School) | D75: B | E75: 38283 | F75: Clear | G75: 49 | H75: =(G75-32)/1.8 -> 9.4444444444444446 | I75: AA | J75: 7.5 | K75: AA | L75: 12.5 | M75: AA
A76: McAleer | B76: Blue Heron Park | C76: 14 | D76: G | E76: 38283 | F76: Cloudy | G76: 52 | H76: =(G76-32)/1.8 -> 11.111111111111111 | I76: AA | J76: 7.5 | K76: AA | L76: 11 | M76: AA
A77: Key: in each case "AA" is the highest level of water quality
A78: TF is temperature Fahrenheit; TC is Temp. Centigrade; TV is the EPA's evaluation of that temperature -- colder the better.
A79: pH is the measure of acidity; HV is the EPA's evaluation of that level --- 6.5 to 8.5 is AA.
A80: DO is dissolved oxygen; DV is the EPA's evaluation of that level -- the higher the better, 10 is AA.