A1: 2006 Lake Forest Park Stream Keepers Chemical Data
A2: Updated: | B2: 38914
A4: Winter 2006
A5: Stream | B5: Reach | C5: # | D5: Box | E5: Date | F5: Turbidity | G5: T F | H5: TC | I5: TV | J5: pH | K5: HV | L5: DO mg/l | M5: DV
A6: Lyon | B6: 35th - North of Ballanger | C6: 2 | D6: B | E6: 38738 | F6: Clear | G6: 46 | H6: =(G6-32)/1.8 -> 7.7777777777777777 | I6: AA | J6: 7.5 | K6: AA | L6: 13
A7: Bruggers | B7: Bruggers Bog | C7: 4.1 | D7: R | E7: 38738 | F7: Clear | G7: 45.5 | H7: =(G7-32)/1.8 -> 7.5 | I7: AA | J7: 7 | K7: AA | L7: 11
A8: Bruggers | B8: Ballinger Way | C8: 4.2 | D8: Y | E8: 38738 | F8: Clear | G8: 48 | H8: =(G8-32)/1.8 -> 8.8888888888888893 | I8: AA | J8: 7.5 | K8: AA | L8: 12
A9: Lyon | B9: 35th (South of 185th) | D9: R | E9: 38738 | F9: Clear | G9: 45 | H9: =(G9-32)/1.8 -> 7.2222222222222223 | I9: AA | J9: 7.5 | K9: AA | L9: 9
A10: Lyon | B10: Town Center | C10: 3 | D10: R | E10: 38738 | F10: Clear | G10: 45.5 | H10: =(G10-32)/1.8 -> 7.5 | I10: AA | J10: 7.5 | K10: AA | L10: 8
A11: McAleer | B11: 196th (Under Road) | C11: 12 | D11: G | E11: 38738 | F11: Clear | G11: 44 | H11: =(G11-32)/1.8 -> 6.6666666666666661 | I11: AA | J11: 7.5 | K11: AA | L11: 11
A12: McAleer | B12: 182th by Big Retain. Wall | C12: 13 | D12: G | E12: 38738 | F12: Clear | G12: 48 | H12: =(G12-32)/1.8 -> 8.8888888888888893 | I12: AA | J12: 7.5 | K12: AA | L12: 7
A13: Brookside | B13: 28th (Grace Cole Park) | C13: 15.2 | D13: Y | E13: 38738 | F13: Clear | G13: 47 | H13: =(G13-32)/1.8 -> 8.3333333333333339 | I13: AA | J13: 7.5 | K13: AA | L13: 10
A14: Brookside | B14: 28th Ave Restoration Site | D14: B | E14: 38738 | F14: Clear | G14: 46 | H14: =(G14-32)/1.8 -> 7.7777777777777777 | I14: AA | J14: 7.5 | K14: AA | L14: 13
A15: Hillside | B15: 35th Ave @ End | C15: 15.3 | D15: Y | E15: 38738 | F15: Cloudy | G15: 48 | H15: =(G15-32)/1.8 -> 8.8888888888888893 | I15: AA | J15: 7.5 | K15: AA | L15: 12
A16: Sheridan | B16: 37th NE (S of School) | D16: B | E16: 38738 | F16: Brown | G16: 46 | H16: =(G16-32)/1.8 -> 7.7777777777777777 | I16: AA | J16: 7.5 | K16: AA | L16: 14
A17: McAleer | B17: Blue Heron Park | C17: 14 | D17: G | E17: 38738 | F17: Clear | G17: 46 | H17: =(G17-32)/1.8 -> 7.7777777777777777 | I17: AA | J17: 7.5 | K17: AA | L17: 7
A18: Key: in each case "AA" is the highest level of water quality
A19: TF is temperature Fahrenheit; TC is Temp. Centigrade; TV is the EPA's evaluation of that temperature -- colder the better.
A20: pH is the measure of acidity; HV is the EPA's evaluation of that level --- 6.5 to 8.5 is AA.
A21: DO is dissolved oxygen; DV is the EPA's evaluation of that level -- the higher the better, 10 is AA.
A22: NS: Not Sampled
A24: Spring 2006
A25: Stream | B25: Reach | C25: # | D25: Box | E25: Date | F25: Turbidity | G25: T F | H25: TC | I25: TV | J25: pH | K25: HV | L25: DO mg/l | M25: DV
A26: Lyon | B26: 35th - North of Ballinger | C26: 2 | D26: B | E26: 38822 | F26: Clear | G26: 49 | H26: =(G26-32)/1.8 -> 9.4444444444444446 | J26: 7.5 | K26: AA | L26: 13 | M26: AA
A27: Bruggers | B27: Bruggers Bog | C27: 4.1 | D27: R | E27: 38822 | F27: Cloudy | G27: 48 | H27: =(G27-32)/1.8 -> 8.8888888888888893 | J27: 7.5 | K27: AA | L27: 11 | M27: AA
A28: Bruggers | B28: Ballinger Way | C28: 4.2 | D28: Y | E28: 38822 | F28: Cloudy | G28: 43 | H28: =(G28-32)/1.8 -> 6.1111111111111107 | J28: 7.5 | K28: AA | L28: 12 | M28: AA
A29: Lyon | B29: 35th (South of 185th) | D29: R | E29: 38822 | F29: Clear | G29: 47 | H29: =(G29-32)/1.8 -> 8.3333333333333339 | J29: 8 | K29: AA | L29: 12 | M29: AA
A30: Lyon | B30: Town Center | C30: 3 | D30: R | E30: 38822 | F30: Clear | G30: 48 | H30: =(G30-32)/1.8 -> 8.8888888888888893 | J30: 8 | K30: AA | L30: 11 | M30: AA
A31: McAleer | B31: 196th (Under Road) | C31: 12 | D31: G | E31: 38822 | F31: Clear | G31: 54 | H31: =(G31-32)/1.8 -> 12.222222222222221 | J31: 7.5 | K31: AA | L31: 13 | M31: AA
A32: McAleer | B32: 182th by Big Retain. Wall | C32: 13 | D32: G | E32: 38822 | F32: Clear | G32: 51 | H32: =(G32-32)/1.8 -> 10.555555555555555 | J32: 7.5 | K32: AA | L32: 14 | M32: AA
A33: Brookside | B33: 28th (Grace Cole Park) | C33: 15.2 | D33: Y | E33: 38822 | F33: Clear | G33: 44 | H33: =(G33-32)/1.8 -> 6.6666666666666661 | J33: 7.5 | K33: AA | L33: 11 | M33: AA
A34: Brookside | B34: * 28th Ave Restoration Site | D34: B | F34: NS | G34: NS | J34: NS | L34: NS
A35: Hillside | B35: 35th Ave @ End | C35: 15.3 | D35: Y | E35: 38822 | F35: Cloudy | G35: 43 | H35: =(G35-32)/1.8 -> 6.1111111111111107 | J35: 7.5 | K35: AA | L35: 11 | M35: AA
A36: Sheridan | B36: 37th NE (S of School) | D36: B | E36: 38822 | F36: Cloudy | G36: 48 | H36: =(G36-32)/1.8 -> 8.8888888888888893 | J36: 7.5 | K36: AA | L36: 12 | M36: AA
A37: McAleer | B37: Blue Heron Park | C37: 14 | D37: G | E37: 38822 | F37: Clear | G37: 48 | H37: =(G37-32)/1.8 -> 8.8888888888888893 | J37: 8 | K37: AA | L37: 14 | M37: AA
A38: Key: in each case "AA" is the highest level of water quality
A39: TF is temperature Fahrenheit; TC is Temp. Centigrade; TV is the EPA's evaluation of that temperature -- colder the better.
A40: pH is the measure of acidity; HV is the EPA's evaluation of that level --- 6.5 to 8.5 is AA.
A41: DO is dissolved oxygen; DV is the EPA's evaluation of that level -- the higher the better, 10 is AA.
A42: * We will not be testing this site any longer.
A43: NS: Not Sampled
A45: Summer 2006
A46: Stream | B46: Reach | C46: # | D46: Box | E46: Date | F46: Turbidity | G46: T F | H46: TC | I46: TV | J46: pH | K46: HV | L46: DO mg/l | M46: DV
A47: Lyon | B47: 35th - North of Ballanger | C47: 2 | D47: B | E47: 38913 | F47: Partly Cloudy | G47: 58 | H47: =(G47-32)/1.8 -> 14.444444444444445 | I47: AA | J47: 7.5 | K47: AA | L47: 11 | M47: AA
A48: Bruggers | B48: Bruggers Bog | C48: 4.1 | D48: R | E48: 38913 | F48: Partly Cloudy | G48: 59 | H48: =(G48-32)/1.8 -> 15 | I48: AA | J48: 7 | K48: AA | L48: 8.5 | M48: AA
A49: Bruggers | B49: Ballinger Way | C49: 4.2 | D49: Y | E49: 38913 | F49: Partly Cloudy | G49: 58 | H49: =(G49-32)/1.8 -> 14.444444444444445 | I49: AA | J49: 7.5 | K49: AA | L49: 10 | M49: AA
A50: Lyon | B50: 35th (South of 185th) | D50: R | E50: 38913 | F50: Partly Cloudy | G50: 59 | H50: =(G50-32)/1.8 -> 15 | I50: AA | J50: 7 | K50: AA | L50: 8.5 | M50: AA
A51: Lyon | B51: Town Center | C51: 3 | D51: R | E51: 38913 | F51: Partly Cloudy | G51: 59 | H51: =(G51-32)/1.8 -> 15 | I51: AA | J51: 7 | K51: AA | L51: 4
A52: McAleer | B52: 196th (Under Road) | C52: 12 | D52: G | E52: 38913 | F52: Partly Cloudy | G52: 59 | H52: =(G52-32)/1.8 -> 15 | I52: AA | J52: 7.5 | K52: AA | L52: 11 | M52: AA
A53: McAleer | B53: 182th by Big Retain. Wall | C53: 13 | D53: G | E53: 38913 | F53: Partly Cloudy | G53: 58 | H53: =(G53-32)/1.8 -> 14.444444444444445 | I53: AA | J53: 7.5 | K53: AA | L53: 11.5 | M53: AA
A54: Brookside | B54: 28th (Grace Cole Park) | C54: 15.2 | D54: Y | E54: 38913 | F54: Partly Cloudy | G54: 58 | H54: =(G54-32)/1.8 -> 14.444444444444445 | I54: AA | J54: 7.5 | K54: AA | L54: 10 | M54: AA
A55: Brookside | B55: 28th Ave Restoration Site | D55: B | E55: 38913 | F55: Partly Cloudy | G55: NS | J55: NS | L55: NS
A56: Hillside | B56: 35th Ave @ End | C56: 15.3 | D56: Y | E56: 38913 | F56: Partly Cloudy | G56: 56 | H56: =(G56-32)/1.8 -> 13.333333333333332 | I56: AA | J56: 8 | K56: AA | L56: 11 | M56: AA
A57: Sheridan | B57: 37th NE (S of School) | D57: B | E57: 38913 | F57: Partly Cloudy | G57: 59 | H57: =(G57-32)/1.8 -> 15 | I57: AA | J57: 7.7 | K57: AA | L57: 10.5 | M57: AA
A58: McAleer | B58: Blue Heron Park | C58: 14 | D58: G | E58: 38913 | F58: Partly Cloudy | G58: 59 | H58: =(G58-32)/1.8 -> 15 | I58: AA | J58: 7.5 | K58: AA | L58: 12 | M58: AA
A59: Key: in each case "AA" is the highest level of water quality
A60: TF is temperature Fahrenheit; TC is Temp. Centigrade; TV is the EPA's evaluation of that temperature -- colder the better.
A61: pH is the measure of acidity; HV is the EPA's evaluation of that level --- 6.5 to 8.5 is AA.
A62: DO is dissolved oxygen; DV is the EPA's evaluation of that level -- the higher the better, 10 is AA.
A63: NS: Not Sampled
A65: Fall 2006
A66: Stream | B66: Reach | C66: # | D66: Box | E66: Date | F66: Turbidity | G66: T F | H66: TC | I66: TV | J66: pH | K66: HV | L66: DO mg/l | M66: DV
A67: Lyon | B67: 35th - North of Ballanger | C67: 2 | D67: B | H67: =(G67-32)/1.8 -> -17.777777777777779
A68: Bruggers | B68: Bruggers Bog | C68: 4.1 | D68: R | H68: =(G68-32)/1.8 -> -17.777777777777779
A69: Bruggers | B69: Ballinger Way | C69: 4.2 | D69: Y | H69: =(G69-32)/1.8 -> -17.777777777777779
A70: Lyon | B70: 35th (South of 185th) | D70: R | H70: =(G70-32)/1.8 -> -17.777777777777779
A71: Lyon | B71: Town Center | C71: 3 | D71: R | H71: =(G71-32)/1.8 -> -17.777777777777779
A72: McAleer | B72: 196th (Under Road) | C72: 12 | D72: G | H72: =(G72-32)/1.8 -> -17.777777777777779
A73: McAleer | B73: 182th by Big Retain. Wall | C73: 13 | D73: G | H73: =(G73-32)/1.8 -> -17.777777777777779
A74: Brookside | B74: 28th (Grace Cole Park) | C74: 15.2 | D74: Y | H74: =(G74-32)/1.8 -> -17.777777777777779
A75: Brookside | B75: 28th Ave Restoration Site | D75: B | H75: =(G75-32)/1.8 -> -17.777777777777779
A76: Hillside | B76: 35th Ave @ End | C76: 15.3 | D76: Y | H76: =(G76-32)/1.8 -> -17.777777777777779
A77: Sheridan | B77: 37th NE (S of School) | D77: B | H77: =(G77-32)/1.8 -> -17.777777777777779
A78: McAleer | B78: Blue Heron Park | C78: 14 | D78: G | H78: =(G78-32)/1.8 -> -17.777777777777779
A79: Key: in each case "AA" is the highest level of water quality
A80: TF is temperature Fahrenheit; TC is Temp. Centigrade; TV is the EPA's evaluation of that temperature -- colder the better.
A81: pH is the measure of acidity; HV is the EPA's evaluation of that level --- 6.5 to 8.5 is AA.
A82: DO is dissolved oxygen; DV is the EPA's evaluation of that level -- the higher the better, 10 is AA.
A83: NS: Not Sampled