A1: 2005 Lake Forest Park Stream Keepers Chemical Data
A2: Updated: | B2: 38640
A4: Winter 2005
A5: Stream | B5: Reach | C5: # | D5: Box | E5: Date | F5: Turbidity | G5: T F | H5: TC | I5: TV | J5: pH | K5: HV | L5: DO mg/l | M5: DV
A6: Lyon | B6: 35th - North of Ballanger | C6: 2 | D6: B | E6: 38003 | F6: Clear | G6: 37 | H6: =(G6-32)/1.8 -> 2.7777777777777777 | I6: AA | J6: 7.5 | K6: AA | L6: 13.5 | M6: AA
A7: Bruggers | B7: Bruggers Bog | C7: 4.1 | D7: R | E7: 38003 | F7: Clear | G7: 39 | H7: =(G7-32)/1.8 -> 3.8888888888888888 | I7: AA | J7: 7 | K7: AA | L7: 12 | M7: AA
A8: Bruggers | B8: Ballinger Way | C8: 4.2 | D8: Y | E8: 38003 | F8: Clear | G8: 38 | H8: =(G8-32)/1.8 -> 3.333333333333333 | I8: AA | J8: 7.5 | K8: AA | L8: 14 | M8: AA
A9: Lyon | B9: 35th (South of 185th) | D9: R | E9: 38003 | F9: Clear | G9: 36 | H9: =(G9-32)/1.8 -> 2.2222222222222223 | I9: AA | J9: 7 | K9: AA | L9: 12 | M9: AA
A10: Lyon | B10: Town Center | C10: 3 | D10: R | E10: 38003 | F10: Clear | G10: 36 | H10: =(G10-32)/1.8 -> 2.2222222222222223 | I10: AA | J10: 7 | K10: AA | L10: 12 | M10: AA
A11: McAleer | B11: 196th (Under Road) | C11: 12 | D11: G | E11: 38003 | F11: PT. Cloudy | G11: 40 | H11: =(G11-32)/1.8 -> 4.4444444444444446 | I11: AA | J11: 7.5 | K11: AA | L11: 11.5 | M11: AA
A12: McAleer | B12: 182th by Big Retain. Wall | C12: 13 | D12: G | E12: 38003 | F12: PT. Cloudy | G12: 40 | H12: =(G12-32)/1.8 -> 4.4444444444444446 | I12: AA | J12: 7.5 | K12: AA | L12: 10 | M12: AA
A13: Brookside | B13: 28th (Grace Cole Park) | C13: 15.2 | D13: Y | E13: 38003 | F13: Clear | G13: 40 | H13: =(G13-32)/1.8 -> 4.4444444444444446 | I13: AA | J13: 7.5 | K13: AA | L13: 14 | M13: AA
A14: Brookside | B14: 28th Ave Restoration Site | D14: B | E14: 38003 | F14: Clear | G14: 40 | H14: =(G14-32)/1.8 -> 4.4444444444444446 | I14: AA | J14: 7.5 | K14: AA | L14: 13 | M14: AA
A15: Hillside | B15: 35th Ave @ End | C15: 15.3 | D15: Y | E15: 38003 | F15: Clear | G15: 38 | H15: =(G15-32)/1.8 -> 3.333333333333333 | I15: AA | J15: 7.75 | K15: AA | L15: 14 | M15: AA
A16: Sheridan | B16: 37th NE (S of School) | D16: B | E16: 38003 | F16: Clear | G16: 38 | H16: =(G16-32)/1.8 -> 3.333333333333333 | I16: AA | J16: 7.5 | K16: AA | L16: 14 | M16: AA
A17: McAleer | B17: Blue Heron Park | C17: 14 | D17: G | E17: 38003 | F17: PT. Cloudy | G17: 40 | H17: =(G17-32)/1.8 -> 4.4444444444444446 | I17: AA | J17: 7.5 | K17: AA | L17: 15.5 | M17: AA
A18: Key: in each case "AA" is the highest level of water quality
A19: TF is temperature Fahrenheit; TC is Temp. Centigrade; TV is the EPA's evaluation of that temperature -- colder the better.
A20: pH is the measure of acidity; HV is the EPA's evaluation of that level --- 6.5 to 8.5 is AA.
A21: DO is dissolved oxygen; DV is the EPA's evaluation of that level -- the higher the better, 10 is AA.
A24: Spring 2005
A25: Stream | B25: Reach | C25: # | D25: Box | E25: Date | F25: Turbidity | G25: T F | H25: TC | I25: TV | J25: pH | K25: HV | L25: DO mg/l | M25: DV
A26: Lyon | B26: 35th - North of Ballanger | C26: 2 | D26: B | E26: 38460 | F26: Brown | G26: 50 | H26: =(G26-32)/1.8 -> 10 | I26: AA | J26: 7 | K26: AA | L26: 12 | M26: AA
A27: Bruggers | B27: Bruggers Bog | C27: 4.1 | D27: R | E27: 38460 | H27: =(G27-32)/1.8 -> -17.777777777777779
A28: Bruggers | B28: Ballinger Way | C28: 4.2 | D28: Y | E28: 38460 | F28: Brown | G28: 50 | H28: =(G28-32)/1.8 -> 10 | I28: AA | J28: 7 | K28: AA | L28: 9
A29: Lyon | B29: 35th (South of 185th) | D29: R | E29: 38460 | F29: Cloudy | G29: 50 | H29: =(G29-32)/1.8 -> 10 | I29: AA | J29: 7 | K29: AA | L29: 8
A30: Lyon | B30: Town Center | C30: 3 | D30: R | E30: 38460 | F30: Cloudy | G30: 50 | H30: =(G30-32)/1.8 -> 10 | I30: AA | J30: 7 | K30: AA | L30: 10 | M30: AA
A31: McAleer | B31: 196th (Under Road) | C31: 12 | D31: G | E31: 38460 | F31: Brown | G31: 50 | H31: =(G31-32)/1.8 -> 10 | I31: AA | J31: 7.3 | K31: AA | L31: 8.5
A32: McAleer | B32: 182th by Big Retain. Wall | C32: 13 | D32: G | E32: 38460 | F32: Brown | G32: 50 | H32: =(G32-32)/1.8 -> 10 | I32: AA | J32: 7.5 | K32: AA | L32: 9.5
A33: Brookside | B33: 28th (Grace Cole Park) | C33: 15.2 | D33: Y | E33: 38460 | F33: Cloudy | G33: 48 | H33: =(G33-32)/1.8 -> 8.8888888888888893 | I33: AA | J33: 7 | K33: AA | L33: 9
A34: Brookside | B34: 28th Ave Restoration Site | D34: B | E34: 38460 | F34: Cloudy | G34: 49 | H34: =(G34-32)/1.8 -> 9.4444444444444446 | I34: AA | J34: 7 | K34: AA | L34: 11 | M34: AA
A35: Hillside | B35: 35th Ave @ End | C35: 15.3 | D35: Y | E35: 38460 | F35: Brown | G35: 50 | H35: =(G35-32)/1.8 -> 10 | I35: AA | J35: 7.5 | K35: AA | L35: 9
A36: Sheridan | B36: 37th NE (S of School) | D36: B | E36: 38460 | F36: Brown | G36: 50 | H36: =(G36-32)/1.8 -> 10 | I36: AA | J36: 7 | K36: AA | L36: 11 | M36: AA
A37: McAleer | B37: Blue Heron Park | C37: 14 | D37: G | E37: 38460 | F37: Brown | G37: 50 | H37: =(G37-32)/1.8 -> 10 | I37: AA | J37: 7.5 | K37: AA | L37: 8
A38: Key: in each case "AA" is the highest level of water quality
A39: TF is temperature Fahrenheit; TC is Temp. Centigrade; TV is the EPA's evaluation of that temperature -- colder the better.
A40: pH is the measure of acidity; HV is the EPA's evaluation of that level --- 6.5 to 8.5 is AA.
A41: DO is dissolved oxygen; DV is the EPA's evaluation of that level -- the higher the better, 10 is AA.
A44: Summer 2005
A45: Stream | B45: Reach | C45: # | D45: Box | E45: Date | F45: Turbidity | G45: T F | H45: TC | I45: TV | J45: pH | K45: HV | L45: DO mg/l | M45: DV
A46: Lyon | B46: 35th - North of Ballanger | C46: 2 | D46: B | E46: 38549 | F46: Clear | G46: 58 | H46: =(G46-32)/1.8 -> 14.444444444444445 | J46: 7.5 | K46: AA | L46: 11 | M46: AA
A47: Bruggers | B47: Bruggers Bog | C47: 4.1 | D47: R | E47: 38549 | F47: Clear | G47: 58 | H47: =(G47-32)/1.8 -> 14.444444444444445 | J47: 7.5 | K47: AA | L47: 9
A48: Bruggers | B48: Ballinger Way | C48: 4.2 | D48: Y | E48: 38549 | F48: Clear | G48: 60 | H48: =(G48-32)/1.8 -> 15.555555555555555 | J48: 7.5 | K48: AA | L48: 11 | M48: AA
A49: Lyon | B49: 35th (South of 185th) | D49: R | E49: 38549 | F49: Clear | G49: 58 | H49: =(G49-32)/1.8 -> 14.444444444444445 | J49: 7.5 | K49: AA | L49: 8
A50: Lyon | B50: Town Center | C50: 3 | D50: R | E50: 38549 | F50: Clear | G50: 56 | H50: =(G50-32)/1.8 -> 13.333333333333332 | J50: 7.5 | K50: AA | L50: 9
A51: McAleer | B51: 196th (Under Road) | C51: 12 | D51: G | E51: 38549 | F51: Clear | G51: 57 | H51: =(G51-32)/1.8 -> 13.888888888888889 | J51: 7.5 | K51: AA | L51: 11 | M51: AA
A52: McAleer | B52: 182th by Big Retain. Wall | C52: 13 | D52: G | E52: 38549 | F52: Clear | G52: 57 | H52: =(G52-32)/1.8 -> 13.888888888888889 | J52: 8 | K52: AA | L52: 11 | M52: AA
A53: Brookside | B53: 28th (Grace Cole Park) | C53: 15.2 | D53: Y | E53: 38549 | F53: Clear | G53: 58 | H53: =(G53-32)/1.8 -> 14.444444444444445 | J53: 7.5 | K53: AA | L53: 11 | M53: AA
A54: Brookside | B54: 28th Ave Restoration Site | D54: B | E54: 38549 | F54: Clear | G54: 58 | H54: =(G54-32)/1.8 -> 14.444444444444445 | J54: 7.5 | K54: AA | L54: 11 | M54: AA
A55: Hillside | B55: 35th Ave @ End | C55: 15.3 | D55: Y | E55: 38549 | F55: Clear | G55: 59 | H55: =(G55-32)/1.8 -> 15 | J55: 7.5 | K55: AA | L55: 11 | M55: AA
A56: Sheridan | B56: 37th NE (S of School) | D56: B | E56: 38549 | F56: Clear | G56: 57 | H56: =(G56-32)/1.8 -> 13.888888888888889 | J56: 7.5 | K56: AA | L56: 10 | M56: AA
A57: McAleer | B57: Blue Heron Park | C57: 14 | D57: G | E57: 38549 | F57: Clear | G57: 57 | H57: =(G57-32)/1.8 -> 13.888888888888889 | J57: 7.5 | K57: AA | L57: 10.5 | M57: AA
A58: Key: in each case "AA" is the highest level of water quality
A59: TF is temperature Fahrenheit; TC is Temp. Centigrade; TV is the EPA's evaluation of that temperature -- colder the better.
A60: pH is the measure of acidity; HV is the EPA's evaluation of that level --- 6.5 to 8.5 is AA.
A61: DO is dissolved oxygen; DV is the EPA's evaluation of that level -- the higher the better, 10 is AA.
A64: Fall 2005
A65: Stream | B65: Reach | C65: # | D65: Box | E65: Date | F65: Turbidity | G65: T F | H65: TC | I65: TV | J65: pH | K65: HV | L65: DO mg/l | M65: DV
A66: Lyon | B66: 35th - North of Ballanger | C66: 2 | D66: B | E66: 38640 | F66: Clear | G66: 55.5 | H66: =(G66-32)/1.8 -> 13.055555555555555 | J66: 7.5 | K66: AA | L66: 12 | M66: AA
A67: Bruggers | B67: Bruggers Bog | C67: 4.1 | D67: R | E67: 38640 | F67: Clear | G67: 56 | H67: =(G67-32)/1.8 -> 13.333333333333332 | J67: 7.5 | K67: AA | L67: 10 | M67: AA
A68: Bruggers | B68: Ballinger Way | C68: 4.2 | D68: Y | E68: 38640 | F68: Clear | G68: 56 | H68: =(G68-32)/1.8 -> 13.333333333333332 | J68: 7.5 | K68: AA | L68: 11 | M68: AA
A69: Lyon | B69: 35th (South of 185th) | D69: R | E69: 38640 | F69: Brown | G69: 55 | H69: =(G69-32)/1.8 -> 12.777777777777777 | J69: 7.5 | K69: AA | L69: 11.5 | M69: AA
A70: Lyon | B70: Town Center | C70: 3 | D70: R | E70: 38640 | F70: Clear | G70: 55 | H70: =(G70-32)/1.8 -> 12.777777777777777 | J70: 7.5 | K70: AA | L70: 11 | M70: AA
A71: McAleer | B71: 196th (Under Road) | C71: 12 | D71: G | E71: 38640 | F71: Clear | G71: 55.5 | H71: =(G71-32)/1.8 -> 13.055555555555555 | J71: 7.5 | K71: AA | L71: 10 | M71: AA
A72: McAleer | B72: 182th by Big Retain. Wall | C72: 13 | D72: G | E72: 38640 | F72: Clear | G72: 55 | H72: =(G72-32)/1.8 -> 12.777777777777777 | J72: 7.5 | K72: AA | L72: 11 | M72: AA
A73: Brookside | B73: 28th (Grace Cole Park) | C73: 15.2 | D73: Y | E73: 38640 | F73: Clear | G73: 56 | H73: =(G73-32)/1.8 -> 13.333333333333332 | J73: 7.5 | K73: AA | L73: 10.5 | M73: AA
A74: Brookside | B74: 28th Ave Restoration Site | D74: B | E74: 38640 | F74: Clear | G74: 55 | H74: =(G74-32)/1.8 -> 12.777777777777777 | J74: 7.5 | K74: AA | L74: 12.5 | M74: AA
A75: Hillside | B75: 35th Ave @ End | C75: 15.3 | D75: Y | E75: 38640 | F75: Clear | G75: 54 | H75: =(G75-32)/1.8 -> 12.222222222222221 | J75: 7.5 | K75: AA | L75: 11 | M75: AA
A76: Sheridan | B76: 37th NE (S of School) | D76: B | E76: 38640 | F76: Clear | G76: 54 | H76: =(G76-32)/1.8 -> 12.222222222222221 | J76: 7.5 | K76: AA | L76: 11.5 | M76: AA
A77: McAleer | B77: Blue Heron Park | C77: 14 | D77: G | E77: 38640 | F77: Clear | G77: 55 | H77: =(G77-32)/1.8 -> 12.777777777777777 | J77: 7.5 | K77: AA | L77: 10 | M77: AA
A78: Key: in each case "AA" is the highest level of water quality
A79: TF is temperature Fahrenheit; TC is Temp. Centigrade; TV is the EPA's evaluation of that temperature -- colder the better.
A80: pH is the measure of acidity; HV is the EPA's evaluation of that level --- 6.5 to 8.5 is AA.
A81: DO is dissolved oxygen; DV is the EPA's evaluation of that level -- the higher the better, 10 is AA.